season,round,date,kickoff,venue,home_team,away_team,pred_home_score,pred_away_score,pred_total,fair_home_odds,fair_away_odds,fair_hcap_line,fair_total_line,h2h_home_105,h2h_away_105,hcap_line_105,hcap_price_105,total_line_105,total_price_105,t1_hcap,t2_hcap,t3_hcap,t4_hcap,t5_hcap,t6_hcap,t7_hcap,final_margin,t1_totals,t2_totals,t3_totals,t4_totals,t5_totals,t6_totals,t7_totals,t8_totals,final_total,t5_home_inj_pts,t5_away_inj_pts,home_outs,away_outs,t10_hcap,t10_totals,t10_home_origin_pts,t10_away_origin_pts,home_origin_outs,away_origin_outs,referee,ref_bucket,weather_condition,temp_c,wind_kmh,t1_note,t2_note,t3_note,t4_note,t5_note,t6_note,t7_note,t8_note,t10_note,explanation,actual_home,actual_away,actual_total,margin_error,total_error,model_version
2026,18,2026-07-03,10:00,CommBank Stadium,Penrith Panthers,South Sydney Rabbitohs,26.9,16.6,43.5,1.243,5.119,-10.3,43.5,1.18,4.88,-10.3,1.905,43.5,1.905,8.12,2.0,-1.0,1.5,3.0,0.72,0.0,10.34,50.21,-0.75,-0.75,-2.0,-1.65,-0.07,0,-1.5,43.49,1.2,6.8,"Casey McLean (rotation, out); Isaiah Papali'i (rotation, out); Mitch Kenny (rotation, doubtful)","Edward Kosi (rotation, out); Latrell Mitchell (elite, out); Isaiah Tass (rotation, out); Jack Wighton (rotation, doubtful); Campbell Graham (rotation, out); Sean Keppie (rotation, out); Talanoa Penitani (rotation, out); Adam Elliott (rotation, out); Alex Johnston (rotation, out)",-4.0,-1.5,6.0,1.5,Nathan Cleary (elite); Isaah Yeo (key); Liam Martin (key),Cameron Murray (key),Adam Gee,neutral,clear,11.6,8.6,Penrith Panthers ELO edge — baseline margin +8.1pt (H:28.1 A:20.0),Style matchup fires family [D] — Penrith Panthers hcap +2.0pt / totals -0.8pt,Situational: Penrith Panthers short turnaround (6d rest) — hcap net -1.00pt / totals -0.75pt,Venue edge: Penrith Panthers at CommBank Stadium — hcap +1.5pt / totals -2.0pt,"Penrith Panthers outs [Casey McLean (rotation), Isaiah Papali'i (rotation), Mitch Kenny (rotation)] = 1.2pts; South Sydney Rabbitohs outs [Edward Kosi (rotation), Latrell Mitchell (elite), Isaiah Tass (rotation), Jack Wighton (rotation), Campbell Graham (rotation), Sean Keppie (rotation), Talanoa Penitani (rotation), Adam Elliott (rotation), Alex Johnston (rotation)] = 6.8pts — net hcap shift +3.0pt",Adam Gee (neutral): neutral ref — no totals or hcap adjustment — hcap +0.7pt / totals -0.1pt,No emotional flags loaded for this game,"Weather: clear (11.6°C, wind 9km/h) — totals -1.5pt",Penrith Panthers Origin G3 outs [Nathan Cleary (elite); Isaah Yeo (key); Liam Martin (key)] = 6.0pts; South Sydney Rabbitohs Origin G3 outs [Cameron Murray (key)] = 1.5pts — net hcap shift -4.0pt,"T1: Penrith Panthers ELO edge — baseline margin +8.1pt (H:28.1 A:20.0) | T2: Style matchup fires family [D] — Penrith Panthers hcap +2.0pt / totals -0.8pt | T3: Situational: Penrith Panthers short turnaround (6d rest) — hcap net -1.00pt / totals -0.75pt | T4: Venue edge: Penrith Panthers at CommBank Stadium — hcap +1.5pt / totals -2.0pt | T5: Penrith Panthers outs [Casey McLean (rotation), Isaiah Papali'i (rotation), Mitch Kenny (rotation)] = 1.2pts; South Sydney Rabbitohs outs [Edward Kosi (rotation), Latrell Mitchell (elite), Isaiah Tass (rotation), Jack Wighton (rotation), Campbell Graham (rotation), Sean Keppie (rotation), Talanoa Penitani (rotation), Adam Elliott (rotation), Alex Johnston (rotation)] = 6.8pts — net hcap shift +3.0pt | T6: Adam Gee (neutral): neutral ref — no totals or hcap adjustment — hcap +0.7pt / totals -0.1pt | T7: No emotional flags loaded for this game | T8: Weather: clear (11.6°C, wind 9km/h) — totals -1.5pt | T10: Penrith Panthers Origin G3 outs [Nathan Cleary (elite); Isaah Yeo (key); Liam Martin (key)] = 6.0pts; South Sydney Rabbitohs Origin G3 outs [Cameron Murray (key)] = 1.5pts — net hcap shift -4.0pt",,,,,,1.0.0-abc
2026,18,2026-07-04,07:30,Jubilee Stadium,St. George Illawarra Dragons,Wests Tigers,20.4,25.5,45.9,2.981,1.505,5.1,45.9,2.84,1.43,5.1,1.905,45.9,1.905,-6.7,0.0,-0.04,-0.5,3.0,-0.79,0.0,-5.03,50.4,0,-1.5,-2.0,-1.43,0.43,0,-0.0,45.9,1.2,6.0,"Moses Suli (rotation, doubtful); Kade Reed (rotation, out); Jaydn Su'A (rotation, out)","Patrick Herbert (rotation, out); Kai Pearce-Paul (rotation, out); Taylan May (rotation, out); Royce Hunt (rotation, out); Jock Madden (rotation, doubtful); Alex Twal (rotation, doubtful); Samuela Fainu (rotation, out); Jarome Luai (elite, out)",0,0,0,0,none,none,Todd Smith,neutral,clear,13.5,7.2,Wests Tigers ELO edge — baseline margin -6.7pt (H:20.8 A:27.4),No style edge fired (families checked: none),Situational: St. George Illawarra Dragons short turnaround (6d rest); Wests Tigers short turnaround (6d rest) — hcap net -0.04pt / totals -1.50pt,Venue edge: Wests Tigers at Jubilee Stadium — hcap -0.5pt / totals -2.0pt,"St. George Illawarra Dragons outs [Moses Suli (rotation), Kade Reed (rotation), Jaydn Su'A (rotation)] = 1.2pts; Wests Tigers outs [Patrick Herbert (rotation), Kai Pearce-Paul (rotation), Taylan May (rotation), Royce Hunt (rotation), Jock Madden (rotation), Alex Twal (rotation), Samuela Fainu (rotation), Jarome Luai (elite)] = 6.0pts — net hcap shift +3.0pt",Todd Smith (neutral): neutral ref — no totals or hcap adjustment — hcap -0.8pt / totals +0.4pt,No emotional flags loaded for this game,"Weather: clear (13.5°C, wind 7km/h) — totals +0.0pt",St. George Illawarra Dragons no Origin outs; Wests Tigers no Origin outs — net hcap shift +0.0pt,"T1: Wests Tigers ELO edge — baseline margin -6.7pt (H:20.8 A:27.4) | T2: No style edge fired (families checked: none) | T3: Situational: St. George Illawarra Dragons short turnaround (6d rest); Wests Tigers short turnaround (6d rest) — hcap net -0.04pt / totals -1.50pt | T4: Venue edge: Wests Tigers at Jubilee Stadium — hcap -0.5pt / totals -2.0pt | T5: St. George Illawarra Dragons outs [Moses Suli (rotation), Kade Reed (rotation), Jaydn Su'A (rotation)] = 1.2pts; Wests Tigers outs [Patrick Herbert (rotation), Kai Pearce-Paul (rotation), Taylan May (rotation), Royce Hunt (rotation), Jock Madden (rotation), Alex Twal (rotation), Samuela Fainu (rotation), Jarome Luai (elite)] = 6.0pts — net hcap shift +3.0pt | T6: Todd Smith (neutral): neutral ref — no totals or hcap adjustment — hcap -0.8pt / totals +0.4pt | T7: No emotional flags loaded for this game | T8: Weather: clear (13.5°C, wind 7km/h) — totals +0.0pt | T10: St. George Illawarra Dragons no Origin outs; Wests Tigers no Origin outs — net hcap shift +0.0pt",,,,,,1.0.0-abc
2026,18,2026-07-04,09:35,Suncorp Stadium,Brisbane Broncos,Cronulla-Sutherland Sharks,14.4,31.6,46.0,13.178,1.082,17.2,46.0,12.55,1.03,17.2,1.905,46.0,1.905,-2.4,-6.0,-0.17,1.5,-3.0,-3.14,0.0,-17.21,50.68,-2.25,0,2.0,-1.5,-1.06,0,-1.95,45.92,6.5,1.0,"Corey Jensen (rotation, out); Ezra Mam (rotation, out); Deine Mariner (rotation, doubtful); Adam Reynolds (elite, out); Aublix Tawha (rotation, out); Xavier Willison (rotation, out); Gehamat Shibasaki (rotation, doubtful); Patrick Carrigan (rotation, out); Jack Gosiewski (rotation, out)","Liam Ison (rotation, out); Toby Rudolf (rotation, out)",-4.0,-1.95,7.5,1.5,Payne Haas (elite); Reece Walsh (elite); Patrick Carrigan (key),Briton Nikora (key),Gerard Sutton,whistle_heavy,clear,15.3,7.9,Cronulla-Sutherland Sharks ELO edge — baseline margin -2.4pt (H:23.0 A:25.4),"Style matchup fires family [A,D] — Cronulla-Sutherland Sharks hcap -6.0pt / totals -2.2pt",Situational: Cronulla-Sutherland Sharks extra rest (13d); Cronulla-Sutherland Sharks travelled 751km — hcap net -0.17pt / totals +0.00pt,Venue edge: Brisbane Broncos at Suncorp Stadium — hcap +1.5pt / totals +2.0pt,"Brisbane Broncos outs [Corey Jensen (rotation), Ezra Mam (rotation), Deine Mariner (rotation), Adam Reynolds (elite), Aublix Tawha (rotation), Xavier Willison (rotation), Gehamat Shibasaki (rotation), Patrick Carrigan (rotation), Jack Gosiewski (rotation)] = 6.5pts; Cronulla-Sutherland Sharks outs [Liam Ison (rotation), Toby Rudolf (rotation)] = 1.0pts — net hcap shift -3.0pt","Gerard Sutton (whistle_heavy): whistle ref — more penalties, lower scoring — hcap -3.1pt / totals -1.1pt",No emotional flags loaded for this game,"Weather: clear (15.3°C, wind 8km/h) — totals -1.9pt",Brisbane Broncos Origin G3 outs [Payne Haas (elite); Reece Walsh (elite); Patrick Carrigan (key)] = 7.5pts; Cronulla-Sutherland Sharks Origin G3 outs [Briton Nikora (key)] = 1.5pts — net hcap shift -4.0pt,"T1: Cronulla-Sutherland Sharks ELO edge — baseline margin -2.4pt (H:23.0 A:25.4) | T2: Style matchup fires family [A,D] — Cronulla-Sutherland Sharks hcap -6.0pt / totals -2.2pt | T3: Situational: Cronulla-Sutherland Sharks extra rest (13d); Cronulla-Sutherland Sharks travelled 751km — hcap net -0.17pt / totals +0.00pt | T4: Venue edge: Brisbane Broncos at Suncorp Stadium — hcap +1.5pt / totals +2.0pt | T5: Brisbane Broncos outs [Corey Jensen (rotation), Ezra Mam (rotation), Deine Mariner (rotation), Adam Reynolds (elite), Aublix Tawha (rotation), Xavier Willison (rotation), Gehamat Shibasaki (rotation), Patrick Carrigan (rotation), Jack Gosiewski (rotation)] = 6.5pts; Cronulla-Sutherland Sharks outs [Liam Ison (rotation), Toby Rudolf (rotation)] = 1.0pts — net hcap shift -3.0pt | T6: Gerard Sutton (whistle_heavy): whistle ref — more penalties, lower scoring — hcap -3.1pt / totals -1.1pt | T7: No emotional flags loaded for this game | T8: Weather: clear (15.3°C, wind 8km/h) — totals -1.9pt | T10: Brisbane Broncos Origin G3 outs [Payne Haas (elite); Reece Walsh (elite); Patrick Carrigan (key)] = 7.5pts; Cronulla-Sutherland Sharks Origin G3 outs [Briton Nikora (key)] = 1.5pts — net hcap shift -4.0pt",,,,,,1.0.0-abc
2026,18,2026-07-05,04:00,CommBank Stadium,Parramatta Eels,Manly-Warringah Sea Eagles,14.6,27.8,42.4,7.371,1.157,13.2,42.4,7.02,1.1,13.2,1.905,42.4,1.905,-10.69,-6.01,1.03,1.5,2.5,-0.05,0.0,-13.22,48.8,-1.5,0,-2.0,-1.95,-0.29,0,-0.6,42.46,3.2,5.8,"Jonah Pezet (rotation, doubtful); Junior Paulo (rotation, out); Will Penisini (rotation, out); Bailey Simonsson (rotation, out); J'maine Hopgood (rotation, out); Matt Doorey (rotation, out); Jake Tago (rotation, out)","Siosiua Taukeiaho (rotation, out); Brandon Wakeham (rotation, out); Kobe Hetherington (rotation, doubtful); Reuben Garrick (rotation, doubtful); Clayton Faulalo (rotation, doubtful); Corey Waddell (rotation, out); Caleb Navale (rotation, out); Luke Brooks (elite, out)",-1.5,-0.6,3.0,1.5,Mitchell Moses (elite),Haumole Olakau'atu (key),Grant Atkins,neutral,clear,13.9,18.0,Manly-Warringah Sea Eagles ELO edge — baseline margin -10.7pt (H:18.4 A:29.1),Style matchup fires family [C] — Manly-Warringah Sea Eagles hcap -6.0pt / totals -1.5pt,Situational: Parramatta Eels extra rest (10d) — hcap net +1.03pt / totals +0.00pt,Venue edge: Parramatta Eels at CommBank Stadium — hcap +1.5pt / totals -2.0pt,"Parramatta Eels outs [Jonah Pezet (rotation), Junior Paulo (rotation), Will Penisini (rotation), Bailey Simonsson (rotation), J'maine Hopgood (rotation), Matt Doorey (rotation), Jake Tago (rotation)] = 3.2pts; Manly-Warringah Sea Eagles outs [Siosiua Taukeiaho (rotation), Brandon Wakeham (rotation), Kobe Hetherington (rotation), Reuben Garrick (rotation), Clayton Faulalo (rotation), Corey Waddell (rotation), Caleb Navale (rotation), Luke Brooks (elite)] = 5.8pts — net hcap shift +2.5pt",Grant Atkins (neutral): neutral ref — no totals or hcap adjustment — hcap -0.1pt / totals -0.3pt,No emotional flags loaded for this game,"Weather: clear (13.9°C, wind 18km/h) — totals -0.6pt",Parramatta Eels Origin G3 outs [Mitchell Moses (elite)] = 3.0pts; Manly-Warringah Sea Eagles Origin G3 outs [Haumole Olakau'atu (key)] = 1.5pts — net hcap shift -1.5pt,"T1: Manly-Warringah Sea Eagles ELO edge — baseline margin -10.7pt (H:18.4 A:29.1) | T2: Style matchup fires family [C] — Manly-Warringah Sea Eagles hcap -6.0pt / totals -1.5pt | T3: Situational: Parramatta Eels extra rest (10d) — hcap net +1.03pt / totals +0.00pt | T4: Venue edge: Parramatta Eels at CommBank Stadium — hcap +1.5pt / totals -2.0pt | T5: Parramatta Eels outs [Jonah Pezet (rotation), Junior Paulo (rotation), Will Penisini (rotation), Bailey Simonsson (rotation), J'maine Hopgood (rotation), Matt Doorey (rotation), Jake Tago (rotation)] = 3.2pts; Manly-Warringah Sea Eagles outs [Siosiua Taukeiaho (rotation), Brandon Wakeham (rotation), Kobe Hetherington (rotation), Reuben Garrick (rotation), Clayton Faulalo (rotation), Corey Waddell (rotation), Caleb Navale (rotation), Luke Brooks (elite)] = 5.8pts — net hcap shift +2.5pt | T6: Grant Atkins (neutral): neutral ref — no totals or hcap adjustment — hcap -0.1pt / totals -0.3pt | T7: No emotional flags loaded for this game | T8: Weather: clear (13.9°C, wind 18km/h) — totals -0.6pt | T10: Parramatta Eels Origin G3 outs [Mitchell Moses (elite)] = 3.0pts; Manly-Warringah Sea Eagles Origin G3 outs [Haumole Olakau'atu (key)] = 1.5pts — net hcap shift -1.5pt",,,,,,1.0.0-abc
2026,18,2026-07-05,06:05,McDonald Jones Stadium,Newcastle Knights,Dolphins,22.6,27.4,50.0,2.902,1.526,4.8,50.0,2.76,1.45,4.8,1.905,50.0,1.905,-3.34,-4.0,0.71,-1.5,0.25,0.58,0.0,-4.8,54.13,-1.5,0,-2.0,0,3.13,0,-3.8,49.96,0.5,0.8,"Asu Kepaoa (rotation, out)","Isaiya Katoa (rotation, out); Tom Gilbert (rotation, doubtful)",2.5,-1.8,3.0,5.5,Kalyn Ponga (elite),Jack Bostock (rotation); Selwyn Cobbo (key); Hamiso Tabuai-Fidow (key); Tom Flegler (key); Max Plath (rotation),Wyatt Raymond,flow_heavy,moderate wind,15.5,27.0,Dolphins ELO edge — baseline margin -3.3pt (H:23.4 A:26.7),Style matchup fires family [C] — Dolphins hcap -4.0pt / totals -1.5pt,Situational: Dolphins travelled 645km — hcap net +0.71pt / totals +0.00pt,Venue edge: Dolphins at McDonald Jones Stadium — hcap -1.5pt / totals -2.0pt,"Newcastle Knights outs [Asu Kepaoa (rotation)] = 0.5pts; Dolphins outs [Isaiya Katoa (rotation), Tom Gilbert (rotation)] = 0.8pts — net hcap shift +0.2pt","Wyatt Raymond (flow_heavy): flow ref — more set restarts, higher totals — hcap +0.6pt / totals +3.1pt",No emotional flags loaded for this game,"Weather: moderate wind (15.5°C, wind 27km/h) — totals -3.8pt",Newcastle Knights Origin G3 outs [Kalyn Ponga (elite)] = 3.0pts; Dolphins Origin G3 outs [Jack Bostock (rotation); Selwyn Cobbo (key); Hamiso Tabuai-Fidow (key); Tom Flegler (key); Max Plath (rotation)] = 5.5pts — net hcap shift +2.5pt,"T1: Dolphins ELO edge — baseline margin -3.3pt (H:23.4 A:26.7) | T2: Style matchup fires family [C] — Dolphins hcap -4.0pt / totals -1.5pt | T3: Situational: Dolphins travelled 645km — hcap net +0.71pt / totals +0.00pt | T4: Venue edge: Dolphins at McDonald Jones Stadium — hcap -1.5pt / totals -2.0pt | T5: Newcastle Knights outs [Asu Kepaoa (rotation)] = 0.5pts; Dolphins outs [Isaiya Katoa (rotation), Tom Gilbert (rotation)] = 0.8pts — net hcap shift +0.2pt | T6: Wyatt Raymond (flow_heavy): flow ref — more set restarts, higher totals — hcap +0.6pt / totals +3.1pt | T7: No emotional flags loaded for this game | T8: Weather: moderate wind (15.5°C, wind 27km/h) — totals -3.8pt | T10: Newcastle Knights Origin G3 outs [Kalyn Ponga (elite)] = 3.0pts; Dolphins Origin G3 outs [Jack Bostock (rotation); Selwyn Cobbo (key); Hamiso Tabuai-Fidow (key); Tom Flegler (key); Max Plath (rotation)] = 5.5pts — net hcap shift +2.5pt",,,,,,1.0.0-abc
