season,round,date,kickoff,venue,home_team,away_team,pred_home_score,pred_away_score,pred_total,fair_home_odds,fair_away_odds,fair_hcap_line,fair_total_line,h2h_home_105,h2h_away_105,hcap_line_105,hcap_price_105,total_line_105,total_price_105,t1_hcap,t2_hcap,t3_hcap,t4_hcap,t5_hcap,t6_hcap,t7_hcap,final_margin,t1_totals,t2_totals,t3_totals,t4_totals,t5_totals,t6_totals,t7_totals,t8_totals,final_total,t5_home_inj_pts,t5_away_inj_pts,home_outs,away_outs,t10_hcap,t10_totals,t10_home_origin_pts,t10_away_origin_pts,home_origin_outs,away_origin_outs,referee,ref_bucket,weather_condition,temp_c,wind_kmh,t1_note,t2_note,t3_note,t4_note,t5_note,t6_note,t7_note,t8_note,t10_note,explanation,actual_home,actual_away,actual_total,margin_error,total_error,model_version
2026,19,2026-07-10,10:00,Campbelltown Sports Stadium,Wests Tigers,New Zealand Warriors,19.4,31.8,51.2,6.635,1.177,12.4,51.2,6.32,1.12,12.4,1.905,51.2,1.905,-8.49,-1.99,0.5,0,-3.0,0.58,0.0,-12.4,50.33,1.5,-1.75,0,-2.02,3.13,0,0.0,51.19,7.0,2.2,"Patrick Herbert (rotation, out); Kai Pearce-Paul (rotation, out); Royce Hunt (rotation, out); Jarome Luai (elite, doubtful); Samuela Fainu (rotation, out); Apisai Koroisau (elite, out); Taylan May (rotation, out)","Alofiana Khan-Pereira (rotation, out); James Fisher-Harris (rotation, doubtful); Leka Halasima (rotation, doubtful); Rocco Berry (rotation, doubtful); Jackson Ford (rotation, out); Tanah Boyd (rotation, out)",0,0,0,0,none,none,Wyatt Raymond,flow_heavy,clear,9.0,2.5,New Zealand Warriors ELO edge — baseline margin -8.5pt (H:19.8 A:28.3),Style matchup fires family [B] — New Zealand Warriors hcap -2.0pt / totals +1.5pt,Situational: Wests Tigers short turnaround (6d rest); New Zealand Warriors extra rest (13d); New Zealand Warriors travelled 2190km — hcap net +0.50pt / totals -1.75pt,No venue edge at Campbelltown Sports Stadium,"Wests Tigers outs [Patrick Herbert (rotation), Kai Pearce-Paul (rotation), Royce Hunt (rotation), Jarome Luai (elite), Samuela Fainu (rotation), Apisai Koroisau (elite), Taylan May (rotation)] = 7.0pts; New Zealand Warriors outs [Alofiana Khan-Pereira (rotation), James Fisher-Harris (rotation), Leka Halasima (rotation), Rocco Berry (rotation), Jackson Ford (rotation), Tanah Boyd (rotation)] = 2.2pts — net hcap shift -3.0pt","Wyatt Raymond (flow_heavy): flow ref — more set restarts, higher totals — hcap +0.6pt / totals +3.1pt",No emotional flags loaded for this game,"Weather: clear (9.0°C, wind 2km/h) — totals +0.0pt",No Origin game this round — T10 skipped,"T1: New Zealand Warriors ELO edge — baseline margin -8.5pt (H:19.8 A:28.3) | T2: Style matchup fires family [B] — New Zealand Warriors hcap -2.0pt / totals +1.5pt | T3: Situational: Wests Tigers short turnaround (6d rest); New Zealand Warriors extra rest (13d); New Zealand Warriors travelled 2190km — hcap net +0.50pt / totals -1.75pt | T4: No venue edge at Campbelltown Sports Stadium | T5: Wests Tigers outs [Patrick Herbert (rotation), Kai Pearce-Paul (rotation), Royce Hunt (rotation), Jarome Luai (elite), Samuela Fainu (rotation), Apisai Koroisau (elite), Taylan May (rotation)] = 7.0pts; New Zealand Warriors outs [Alofiana Khan-Pereira (rotation), James Fisher-Harris (rotation), Leka Halasima (rotation), Rocco Berry (rotation), Jackson Ford (rotation), Tanah Boyd (rotation)] = 2.2pts — net hcap shift -3.0pt | T6: Wyatt Raymond (flow_heavy): flow ref — more set restarts, higher totals — hcap +0.6pt / totals +3.1pt | T7: No emotional flags loaded for this game | T8: Weather: clear (9.0°C, wind 2km/h) — totals +0.0pt | T10: No Origin game this round — T10 skipped",,,,,,1.0.0-abc
2026,19,2026-07-11,05:00,Kayo Stadium,Dolphins,Cronulla-Sutherland Sharks,25.6,25.3,50.9,1.961,2.041,-0.3,50.9,1.87,1.94,-0.3,1.905,50.9,1.905,1.7,-0.01,-0.14,0,-0.5,-0.79,0.0,0.26,51.17,0,-0.75,0,0,0.43,0,0.0,50.85,1.0,0.5,"Ray Stone (rotation, out); Isaiya Katoa (rotation, out)","Toby Rudolf (rotation, out)",0,0,0,0,none,none,Todd Smith,neutral,clear,18.0,8.3,Dolphins ELO edge — baseline margin +1.7pt (H:25.1 A:23.4),No style edge fired (families checked: none),Situational: Dolphins short turnaround (6d rest); Cronulla-Sutherland Sharks travelled 779km — hcap net -0.14pt / totals -0.75pt,No venue edge at Kayo Stadium,"Dolphins outs [Ray Stone (rotation), Isaiya Katoa (rotation)] = 1.0pts; Cronulla-Sutherland Sharks outs [Toby Rudolf (rotation)] = 0.5pts — net hcap shift -0.5pt",Todd Smith (neutral): neutral ref — no totals or hcap adjustment — hcap -0.8pt / totals +0.4pt,No emotional flags loaded for this game,"Weather: clear (18.0°C, wind 8km/h) — totals +0.0pt",No Origin game this round — T10 skipped,"T1: Dolphins ELO edge — baseline margin +1.7pt (H:25.1 A:23.4) | T2: No style edge fired (families checked: none) | T3: Situational: Dolphins short turnaround (6d rest); Cronulla-Sutherland Sharks travelled 779km — hcap net -0.14pt / totals -0.75pt | T4: No venue edge at Kayo Stadium | T5: Dolphins outs [Ray Stone (rotation), Isaiya Katoa (rotation)] = 1.0pts; Cronulla-Sutherland Sharks outs [Toby Rudolf (rotation)] = 0.5pts — net hcap shift -0.5pt | T6: Todd Smith (neutral): neutral ref — no totals or hcap adjustment — hcap -0.8pt / totals +0.4pt | T7: No emotional flags loaded for this game | T8: Weather: clear (18.0°C, wind 8km/h) — totals +0.0pt | T10: No Origin game this round — T10 skipped",,,,,,1.0.0-abc
2026,19,2026-07-11,07:30,Accor Stadium,Canterbury-Bankstown Bulldogs,Canberra Raiders,18.1,18.3,36.4,2.027,1.974,0.2,36.4,1.93,1.88,0.2,1.905,36.4,1.905,3.21,0.0,1.25,1.5,-3.0,-3.14,0.0,-0.18,40.31,0,0,-2.0,-0.82,-1.06,0,-0.0,36.42,4.2,1.0,"Jake Turpin (key, out); Mitchell Woods (rotation, out); Jacob Kiraz (rotation, out); Samuel Hughes (rotation, out); Jacob Preston (rotation, doubtful); Viliame Kikau (rotation, out); Sitili Tupouniua (rotation, out)","Noah Martin (rotation, out); Josh Papalii (rotation, doubtful); Daine Laurie (rotation, doubtful)",0,0,0,0,none,none,Gerard Sutton,whistle_heavy,clear,14.2,5.8,Canterbury-Bankstown Bulldogs ELO edge — baseline margin +3.2pt (H:23.2 A:20.0),No style edge fired (families checked: none),Situational: Canterbury-Bankstown Bulldogs extra rest (15d); Canberra Raiders extra rest (13d) — hcap net +1.25pt / totals +0.00pt,Venue edge: Canterbury-Bankstown Bulldogs at Accor Stadium — hcap +1.5pt / totals -2.0pt,"Canterbury-Bankstown Bulldogs outs [Jake Turpin (key), Mitchell Woods (rotation), Jacob Kiraz (rotation), Samuel Hughes (rotation), Jacob Preston (rotation), Viliame Kikau (rotation), Sitili Tupouniua (rotation)] = 4.2pts; Canberra Raiders outs [Noah Martin (rotation), Josh Papalii (rotation), Daine Laurie (rotation)] = 1.0pts — net hcap shift -3.0pt","Gerard Sutton (whistle_heavy): whistle ref — more penalties, lower scoring — hcap -3.1pt / totals -1.1pt",No emotional flags loaded for this game,"Weather: clear (14.2°C, wind 6km/h) — totals +0.0pt",No Origin game this round — T10 skipped,"T1: Canterbury-Bankstown Bulldogs ELO edge — baseline margin +3.2pt (H:23.2 A:20.0) | T2: No style edge fired (families checked: none) | T3: Situational: Canterbury-Bankstown Bulldogs extra rest (15d); Canberra Raiders extra rest (13d) — hcap net +1.25pt / totals +0.00pt | T4: Venue edge: Canterbury-Bankstown Bulldogs at Accor Stadium — hcap +1.5pt / totals -2.0pt | T5: Canterbury-Bankstown Bulldogs outs [Jake Turpin (key), Mitchell Woods (rotation), Jacob Kiraz (rotation), Samuel Hughes (rotation), Jacob Preston (rotation), Viliame Kikau (rotation), Sitili Tupouniua (rotation)] = 4.2pts; Canberra Raiders outs [Noah Martin (rotation), Josh Papalii (rotation), Daine Laurie (rotation)] = 1.0pts — net hcap shift -3.0pt | T6: Gerard Sutton (whistle_heavy): whistle ref — more penalties, lower scoring — hcap -3.1pt / totals -1.1pt | T7: No emotional flags loaded for this game | T8: Weather: clear (14.2°C, wind 6km/h) — totals +0.0pt | T10: No Origin game this round — T10 skipped",,,,,,1.0.0-abc
2026,19,2026-07-11,09:35,Allianz Stadium,Sydney Roosters,Parramatta Eels,32.2,18.1,50.3,1.136,8.334,-14.1,50.3,1.08,7.94,-14.1,1.905,50.3,1.905,9.56,-0.0,2.03,1.5,0.25,0.72,0.0,14.06,50.08,0,-0.75,2.0,-0.97,-0.07,0,-0.0,50.28,2.8,3.0,"Angus Crichton (rotation, out); Daniel Tupou (rotation, doubtful); Lindsay Collins (rotation, out); Nat Butcher (rotation, out); Cody Ramsey (rotation, out); Blake Steep (rotation, out)","Jake Tago (rotation, out); Will Penisini (rotation, out); Junior Paulo (rotation, out); Bailey Simonsson (rotation, out); Matt Doorey (rotation, out); J'maine Hopgood (rotation, out)",0,0,0,0,none,none,Adam Gee,neutral,clear,13.2,14.4,Sydney Roosters ELO edge — baseline margin +9.6pt (H:28.8 A:19.2),No style edge fired (families checked: none),Situational: Sydney Roosters extra rest (15d); Parramatta Eels short turnaround (6d rest) — hcap net +2.03pt / totals -0.75pt,Venue edge: Sydney Roosters at Allianz Stadium — hcap +1.5pt / totals +2.0pt,"Sydney Roosters outs [Angus Crichton (rotation), Daniel Tupou (rotation), Lindsay Collins (rotation), Nat Butcher (rotation), Cody Ramsey (rotation), Blake Steep (rotation)] = 2.8pts; Parramatta Eels outs [Jake Tago (rotation), Will Penisini (rotation), Junior Paulo (rotation), Bailey Simonsson (rotation), Matt Doorey (rotation), J'maine Hopgood (rotation)] = 3.0pts — net hcap shift +0.2pt",Adam Gee (neutral): neutral ref — no totals or hcap adjustment — hcap +0.7pt / totals -0.1pt,No emotional flags loaded for this game,"Weather: clear (13.2°C, wind 14km/h) — totals +0.0pt",No Origin game this round — T10 skipped,"T1: Sydney Roosters ELO edge — baseline margin +9.6pt (H:28.8 A:19.2) | T2: No style edge fired (families checked: none) | T3: Situational: Sydney Roosters extra rest (15d); Parramatta Eels short turnaround (6d rest) — hcap net +2.03pt / totals -0.75pt | T4: Venue edge: Sydney Roosters at Allianz Stadium — hcap +1.5pt / totals +2.0pt | T5: Sydney Roosters outs [Angus Crichton (rotation), Daniel Tupou (rotation), Lindsay Collins (rotation), Nat Butcher (rotation), Cody Ramsey (rotation), Blake Steep (rotation)] = 2.8pts; Parramatta Eels outs [Jake Tago (rotation), Will Penisini (rotation), Junior Paulo (rotation), Bailey Simonsson (rotation), Matt Doorey (rotation), J'maine Hopgood (rotation)] = 3.0pts — net hcap shift +0.2pt | T6: Adam Gee (neutral): neutral ref — no totals or hcap adjustment — hcap +0.7pt / totals -0.1pt | T7: No emotional flags loaded for this game | T8: Weather: clear (13.2°C, wind 14km/h) — totals +0.0pt | T10: No Origin game this round — T10 skipped",,,,,,1.0.0-abc
2026,19,2026-07-12,04:00,Accor Stadium,South Sydney Rabbitohs,Newcastle Knights,28.1,22.6,50.7,1.478,3.093,-5.5,50.7,1.41,2.95,-5.5,1.905,50.7,1.905,4.73,2.24,0.12,1.5,-3.0,-0.05,0.0,5.54,54.56,0,0,-2.0,-1.57,-0.29,0,0.0,50.7,6.2,1.5,"Isaiah Tass (rotation, out); Campbell Graham (rotation, doubtful); Cody Walker (rotation, out); Latrell Mitchell (elite, out); Alex Johnston (rotation, out); Sean Keppie (rotation, out); Talanoa Penitani (rotation, out); Adam Elliott (rotation, out)","Trey Mooney (rotation, out); Jacob Saifiti (rotation, out); Asu Kepaoa (rotation, out)",0,0,0,0,none,none,Grant Atkins,neutral,clear,14.4,19.1,South Sydney Rabbitohs ELO edge — baseline margin +4.7pt (H:27.5 A:22.8),Style matchup fires family [none] — South Sydney Rabbitohs hcap +2.2pt / totals +0.0pt,Situational: no significant rest/travel factors — hcap net +0.12pt / totals +0.00pt,Venue edge: South Sydney Rabbitohs at Accor Stadium — hcap +1.5pt / totals -2.0pt,"South Sydney Rabbitohs outs [Isaiah Tass (rotation), Campbell Graham (rotation), Cody Walker (rotation), Latrell Mitchell (elite), Alex Johnston (rotation), Sean Keppie (rotation), Talanoa Penitani (rotation), Adam Elliott (rotation)] = 6.2pts; Newcastle Knights outs [Trey Mooney (rotation), Jacob Saifiti (rotation), Asu Kepaoa (rotation)] = 1.5pts — net hcap shift -3.0pt",Grant Atkins (neutral): neutral ref — no totals or hcap adjustment — hcap -0.1pt / totals -0.3pt,No emotional flags loaded for this game,"Weather: clear (14.4°C, wind 19km/h) — totals +0.0pt",No Origin game this round — T10 skipped,"T1: South Sydney Rabbitohs ELO edge — baseline margin +4.7pt (H:27.5 A:22.8) | T2: Style matchup fires family [none] — South Sydney Rabbitohs hcap +2.2pt / totals +0.0pt | T3: Situational: no significant rest/travel factors — hcap net +0.12pt / totals +0.00pt | T4: Venue edge: South Sydney Rabbitohs at Accor Stadium — hcap +1.5pt / totals -2.0pt | T5: South Sydney Rabbitohs outs [Isaiah Tass (rotation), Campbell Graham (rotation), Cody Walker (rotation), Latrell Mitchell (elite), Alex Johnston (rotation), Sean Keppie (rotation), Talanoa Penitani (rotation), Adam Elliott (rotation)] = 6.2pts; Newcastle Knights outs [Trey Mooney (rotation), Jacob Saifiti (rotation), Asu Kepaoa (rotation)] = 1.5pts — net hcap shift -3.0pt | T6: Grant Atkins (neutral): neutral ref — no totals or hcap adjustment — hcap -0.1pt / totals -0.3pt | T7: No emotional flags loaded for this game | T8: Weather: clear (14.4°C, wind 19km/h) — totals +0.0pt | T10: No Origin game this round — T10 skipped",,,,,,1.0.0-abc
2026,19,2026-07-12,06:05,4 Pines Park,Manly-Warringah Sea Eagles,North Queensland Cowboys,27.1,17.9,45.0,1.285,4.512,-9.2,45.0,1.22,4.3,-9.2,1.905,45.0,1.905,6.46,4.0,0.34,1.5,-3.0,-0.13,0.0,9.17,47.25,-3.0,-1.0,1.58,-0.82,0.99,0,-0.0,45.0,5.0,0.2,"Clayton Faulalo (rotation, out); Siosiua Taukeiaho (rotation, out); Brandon Wakeham (rotation, out); Caleb Navale (rotation, out); Luke Brooks (elite, out)","Tom Dearden (rotation, doubtful)",0,0,0,0,none,none,Peter Gough,flow_heavy,clear,13.3,18.7,Manly-Warringah Sea Eagles ELO edge — baseline margin +6.5pt (H:26.5 A:20.1),"Style matchup fires family [A,C] — Manly-Warringah Sea Eagles hcap +4.0pt / totals -3.0pt",Situational: North Queensland Cowboys extra rest (15d); North Queensland Cowboys travelled 1672km — hcap net +0.34pt / totals -1.00pt,Venue edge: Manly-Warringah Sea Eagles at 4 Pines Park — hcap +1.5pt / totals +1.6pt,"Manly-Warringah Sea Eagles outs [Clayton Faulalo (rotation), Siosiua Taukeiaho (rotation), Brandon Wakeham (rotation), Caleb Navale (rotation), Luke Brooks (elite)] = 5.0pts; North Queensland Cowboys outs [Tom Dearden (rotation)] = 0.2pts — net hcap shift -3.0pt","Peter Gough (flow_heavy): flow ref — more set restarts, higher totals — hcap -0.1pt / totals +1.0pt",No emotional flags loaded for this game,"Weather: clear (13.3°C, wind 19km/h) — totals +0.0pt",No Origin game this round — T10 skipped,"T1: Manly-Warringah Sea Eagles ELO edge — baseline margin +6.5pt (H:26.5 A:20.1) | T2: Style matchup fires family [A,C] — Manly-Warringah Sea Eagles hcap +4.0pt / totals -3.0pt | T3: Situational: North Queensland Cowboys extra rest (15d); North Queensland Cowboys travelled 1672km — hcap net +0.34pt / totals -1.00pt | T4: Venue edge: Manly-Warringah Sea Eagles at 4 Pines Park — hcap +1.5pt / totals +1.6pt | T5: Manly-Warringah Sea Eagles outs [Clayton Faulalo (rotation), Siosiua Taukeiaho (rotation), Brandon Wakeham (rotation), Caleb Navale (rotation), Luke Brooks (elite)] = 5.0pts; North Queensland Cowboys outs [Tom Dearden (rotation)] = 0.2pts — net hcap shift -3.0pt | T6: Peter Gough (flow_heavy): flow ref — more set restarts, higher totals — hcap -0.1pt / totals +1.0pt | T7: No emotional flags loaded for this game | T8: Weather: clear (13.3°C, wind 19km/h) — totals +0.0pt | T10: No Origin game this round — T10 skipped",,,,,,1.0.0-abc
2026,19,2026-07-12,08:15,AAMI Park,Melbourne Storm,Gold Coast Titans,28.3,14.1,42.4,1.134,8.45,-14.2,42.4,1.08,8.05,-14.2,1.905,42.4,1.905,9.67,4.0,1.47,1.5,-2.5,0,0.0,14.14,46.78,-1.5,-1.0,-1.0,-0.9,0,0,0.0,42.38,4.0,1.5,"Manaia Waitere (rotation, out); Marion Seve (rotation, out); Jack Howarth (rotation, out); Tui Kamikamica (rotation, out); Hugo Peel (rotation, doubtful); Nick Meaney (rotation, doubtful); Ativalu Lisati (rotation, out); Eliesa Katoa (rotation, out); Xavier Coates (rotation, out)","Brock Gray (rotation, out); Jensen Taumoepeau (rotation, out); Jaimin Jolliffe (rotation, out)",0,0,0,0,none,none,Tyson Brough,neutral,clear,12.7,14.4,Melbourne Storm ELO edge — baseline margin +9.7pt (H:28.0 A:18.4),Style matchup fires family [A] — Melbourne Storm hcap +4.0pt / totals -1.5pt,Situational: Melbourne Storm extra rest (15d); Gold Coast Titans extra rest (16d); Gold Coast Titans travelled 1336km — hcap net +1.47pt / totals -1.00pt,Venue edge: Melbourne Storm at AAMI Park — hcap +1.5pt / totals -1.0pt,"Melbourne Storm outs [Manaia Waitere (rotation), Marion Seve (rotation), Jack Howarth (rotation), Tui Kamikamica (rotation), Hugo Peel (rotation), Nick Meaney (rotation), Ativalu Lisati (rotation), Eliesa Katoa (rotation), Xavier Coates (rotation)] = 4.0pts; Gold Coast Titans outs [Brock Gray (rotation), Jensen Taumoepeau (rotation), Jaimin Jolliffe (rotation)] = 1.5pts — net hcap shift -2.5pt",Tyson Brough (neutral): neutral ref — no totals or hcap adjustment — hcap +0.0pt / totals +0.0pt,No emotional flags loaded for this game,"Weather: clear (12.7°C, wind 14km/h) — totals +0.0pt",No Origin game this round — T10 skipped,"T1: Melbourne Storm ELO edge — baseline margin +9.7pt (H:28.0 A:18.4) | T2: Style matchup fires family [A] — Melbourne Storm hcap +4.0pt / totals -1.5pt | T3: Situational: Melbourne Storm extra rest (15d); Gold Coast Titans extra rest (16d); Gold Coast Titans travelled 1336km — hcap net +1.47pt / totals -1.00pt | T4: Venue edge: Melbourne Storm at AAMI Park — hcap +1.5pt / totals -1.0pt | T5: Melbourne Storm outs [Manaia Waitere (rotation), Marion Seve (rotation), Jack Howarth (rotation), Tui Kamikamica (rotation), Hugo Peel (rotation), Nick Meaney (rotation), Ativalu Lisati (rotation), Eliesa Katoa (rotation), Xavier Coates (rotation)] = 4.0pts; Gold Coast Titans outs [Brock Gray (rotation), Jensen Taumoepeau (rotation), Jaimin Jolliffe (rotation)] = 1.5pts — net hcap shift -2.5pt | T6: Tyson Brough (neutral): neutral ref — no totals or hcap adjustment — hcap +0.0pt / totals +0.0pt | T7: No emotional flags loaded for this game | T8: Weather: clear (12.7°C, wind 14km/h) — totals +0.0pt | T10: No Origin game this round — T10 skipped",,,,,,1.0.0-abc
